taste,reason
 I enjoy thought-provoking dramas and character-driven narratives.  |  I appreciate international cinema and unique storytelling styles.  ," Many of the films I've rated highly, like ""How Green Was My Valley"" and ""Death and the Maiden,"" focus on deep emotional themes and complex characters.|  My ratings for films such as ""I Am Cuba"" and ""Children of Paradise"" reflect my interest in diverse cultural perspectives and innovative filmmaking techniques."
 Eclectic mix of comedy and drama  |  Appreciation for unique storytelling and unconventional narratives  ," I enjoy films that blend humor with deeper emotional themes, as seen in titles like ""Better Off Dead..."" and ""Tender Mercies.""|  I gravitate towards movies that offer distinctive perspectives and innovative plots, evident in films like ""Schizopolis"" and ""Love Serenade."""
 Eclectic mix of dark comedies and thought-provoking dramas  |  Appreciation for international cinema and unique storytelling  ," I enjoy films that blend humor with deeper themes, often exploring the absurdities of life and human nature.|  I am drawn to films from different cultures that offer fresh perspectives and innovative narratives, as seen in titles like ""Chungking Express"" and ""Children of Heaven."""
 I enjoy horror and psychological thrillers.  |  I appreciate character-driven dramas.  ," My high ratings for ""Night of the Living Dead"" and ""Fight Club"" reflect my appreciation for intense narratives that explore fear and the human psyche.|  My positive ratings for ""Elizabeth"" and ""Gods and Monsters"" indicate my interest in films that delve into complex characters and their emotional journeys."
 I enjoy romantic and feel-good films.  |  I appreciate thought-provoking dramas and unique storytelling.  ," Many of the movies I rated highly, like ""To Sir with Love,"" ""Romancing the Stone,"" and ""Pretty Woman,"" feature strong romantic elements and uplifting narratives.|  Films such as ""Ghost,"" ""Breaking Away,"" and ""Apocalypse Now"" showcase complex characters and intricate plots that resonate with me."
 I enjoy thought-provoking dramas and intense narratives.  |  I appreciate animated films and unique storytelling styles.  ," Many of the films I rated highly, such as ""Schindler's List"" and ""Boys Don't Cry,"" delve into deep emotional themes and complex character studies.|  My high ratings for ""Creature Comforts"" and ""Wallace & Gromit: The Best of Aardman Animation"" reflect my enjoyment of creativity and humor in animation."
 I enjoy thought-provoking dramas and psychological thrillers.  |  I appreciate a mix of whimsical comedies and animated features.  ," Many of the films I rated highly, such as ""American Beauty,"" ""One Flew Over the Cuckoo's Nest,"" and ""Vertigo,"" delve into complex characters and intricate narratives that challenge my perspective.|  My ratings for movies like ""There's Something About Mary,"" ""Aladdin,"" and ""Fantasia"" reflect my enjoyment of humor and creativity, often with a light-hearted or fantastical touch."
 I enjoy thought-provoking dramas and dark comedies.  |  I appreciate romantic and feel-good films.  ," My ratings for films like ""Dr. Strangelove"" and ""One Flew Over the Cuckoo's Nest"" show my appreciation for complex narratives and satirical elements.|  My high ratings for movies like ""Casablanca,"" ""Dirty Dancing,"" and ""Clueless"" indicate that I enjoy stories centered around love and uplifting themes."
 I enjoy thought-provoking dramas and comedies.  |  I appreciate international cinema and unique storytelling.  ," My ratings reflect a preference for films that blend humor with deeper social commentary, as seen in titles like ""Dr. Strangelove"" and ""Fargo.""|  My high ratings for films like ""Seven Samurai"" and ""Tampopo"" indicate a liking for diverse narratives and cultural perspectives in filmmaking."
 I enjoy a mix of drama and adventure films.  |  I have a preference for films that blend humor with emotional depth.  ," My ratings reflect a strong appreciation for character-driven stories and thrilling journeys, as seen in movies like ""GoodFellas,"" ""Indiana Jones and the Last Crusade,"" and ""Boys Don't Cry.""|  I tend to rate highly movies that balance comedy and poignant themes, such as ""When Harry Met Sally..."" and ""Fish Called Wanda, A,"" showcasing my enjoyment of both laughter and meaningful storytelling."
 I enjoy thought-provoking dramas.  |  I appreciate classic films with strong narratives.  ," Many of the films I've rated highly, like ""To Kill a Mockingbird"" and ""On the Waterfront,"" explore complex social issues and character development.|  My favorites, such as ""Casablanca"" and ""Breakfast at Tiffany's,"" showcase timeless storytelling and memorable performances."
 Eclectic mix of comedy and drama  |  Appreciation for international cinema  ," I enjoy films that blend humor with emotional depth, as seen in titles like ""Ninotchka"" and ""Music of the Heart.""|  I gravitate towards films from various cultures, such as ""Not One Less"" and ""Paris, Texas,"" which offer unique storytelling perspectives."
 Emotional and thought-provoking dramas  |  Inspirational biographical narratives  ," I enjoy films that explore deep human experiences and moral dilemmas, often featuring strong character development and impactful storytelling.|  I am drawn to movies that depict real-life figures and their journeys, showcasing resilience and the pursuit of justice or personal growth."
 I enjoy a mix of fantasy and horror films.  |  I appreciate thought-provoking dramas and comedies.  ," My ratings for movies like ""Ladyhawke,"" ""Nightmare on Elm Street,"" and ""Phantasm"" show my appreciation for imaginative storytelling and thrilling experiences.|  My high ratings for films such as ""Do the Right Thing,"" ""Dead Poets Society,"" and ""Clueless"" indicate my interest in narratives that explore complex themes while also providing humor and insight."
 I enjoy dark comedies and satirical films.  |  I appreciate thought-provoking dramas and thrillers.  ," Many of the movies I rated highly, like ""Waiting for Guffman"" and ""Brazil,"" blend humor with sharp social commentary.|  Films such as ""Anatomy of a Murder"" and ""Apocalypse Now"" showcase complex narratives and intense character development that resonate with me."
 I enjoy a blend of comedy and drama.  |  I am drawn to classic and thought-provoking narratives.  ," My ratings reflect a strong appreciation for films that balance humor with emotional depth, such as ""Fletch"" and ""On the Waterfront.""|  I favor films that offer rich storytelling and character development, as seen in titles like ""Lawrence of Arabia"" and ""Roman Holiday."""
 Eclectic mix of drama and adventure  |  Appreciation for thought-provoking cinema  ," I enjoy films that blend emotional storytelling with thrilling narratives, as seen in titles like ""Raiders of the Lost Ark"" and ""Secrets & Lies.""|  I gravitate towards movies that challenge perspectives and provoke deep thought, evident in my favorites like ""2001: A Space Odyssey"" and ""Taste of Cherry."""
 Family-friendly and animated films  |  Thought-provoking dramas  ," I enjoy movies that appeal to all ages, featuring imaginative storytelling and heartwarming themes, as seen in titles like Mary Poppins and Dumbo.|  I appreciate films that tackle complex themes and emotional depth, which is evident in my high ratings for Schindler's List, Sophie's Choice, and Gandhi."
 Eclectic mix of drama and fantasy  |  Appreciation for international cinema  ," I enjoy films that blend emotional storytelling with imaginative elements, as seen in titles like ""Pather Panchali"" and ""Jumanji.""|  I gravitate towards films from different cultures, such as ""Chungking Express"" and ""Battleship Potemkin,"" which showcase unique narratives and styles."
 I enjoy thought-provoking dramas and character-driven narratives.  |  I appreciate films that explore unique perspectives and cultural stories.  ," Many of the films I rated highly, such as ""The Conformist"" and ""Midaq Alley,"" focus on deep emotional and social themes, showcasing complex characters and their journeys.|  My ratings for movies like ""Children of the Revolution"" and ""Once Upon a Time... When We Were Colored"" reflect my interest in narratives that highlight diverse experiences and historical contexts."
 I enjoy thought-provoking dramas and character-driven narratives.  |  I appreciate unique storytelling and unconventional narratives.  ," Many of the films I rated highly, like ""Schindler's List,"" ""Raging Bull,"" and ""12 Angry Men,"" focus on deep emotional themes and complex characters.|  My ratings for films like ""Tampopo,"" ""Some Folks Call It a Sling Blade,"" and ""And Now for Something Completely Different"" reflect my interest in innovative plots and distinctive filmmaking styles."
 I enjoy heartfelt dramas and emotional narratives.  |  I appreciate classic and timeless storytelling.  ," Many of the movies I rated highly, like ""Philadelphia"" and ""Breaking the Waves,"" focus on deep emotional themes and character development.|  My ratings for films such as ""Bicycle Thief"" and ""On the Waterfront"" reflect my preference for well-crafted stories that have stood the test of time."
 Emotional dramas with strong character development  |  Romantic comedies with heartfelt moments  ," I enjoy films that explore deep emotional themes and showcase complex characters, as seen in titles like ""Dead Man Walking"" and ""Forrest Gump.""|  I appreciate lighthearted films that blend romance and humor, which is evident in my enjoyment of ""When Harry Met Sally..."" and ""Four Weddings and a Funeral."""
 Romantic Comedies and Dramas  |  Classic and Iconic Films  ," I enjoy films that blend humor with emotional depth, often featuring complex relationships and character development.|  I appreciate movies that have stood the test of time, showcasing strong storytelling and memorable performances across various genres."
 Emotional and Thought-Provoking Dramas  |  Light-hearted Comedies and Feel-Good Films  ," I enjoy films that explore deep emotional themes and complex characters, as seen in titles like ""All About My Mother"" and ""To Kill a Mockingbird.""|  I appreciate movies that provide humor and joy, such as ""Sister Act"" and ""A Grand Day Out,"" which uplift my spirits and entertain."
 Strong preference for character-driven dramas  |  Appreciation for international and culturally rich narratives  ," I enjoy films that explore complex characters and their emotional journeys, as seen in titles like ""M. Butterfly"" and ""Wild Reeds.""|  I am drawn to movies that offer diverse cultural perspectives, such as ""Seven Samurai"" and ""Train of Life,"" which highlight unique storytelling from different backgrounds."
 Romantic Comedies and Feel-Good Films  |  International and Art House Cinema  ," I enjoy lighthearted narratives that blend humor with romance, often featuring charming characters and uplifting storylines.|  I appreciate films that offer unique cultural perspectives and artistic storytelling, often exploring deeper themes and emotions."
 Romantic and Dramatic Narratives  |  Engaging and Thought-Provoking Stories  ," I enjoy films that explore deep emotional connections and complex relationships, as seen in titles like ""Persuasion,"" ""Jane Eyre,"" and ""Sophie’s Choice.""|  I appreciate movies that challenge my thinking and offer unique perspectives, reflected in my ratings for ""Lawrence of Arabia,"" ""Mystery Science Theater 3000: The Movie,"" and ""In the Mouth of Madness."""
 I enjoy thought-provoking dramas and character-driven narratives.  |  I appreciate unique storytelling and unconventional comedies.  ," My ratings reflect a preference for films that explore deep emotional themes and complex characters, such as ""Dancer in the Dark"" and ""My Life as a Dog.""|  I tend to rate highly films that offer original plots and humor, as seen in titles like ""Withnail and I"" and ""Office Space."""
 Emotional and thought-provoking dramas  |  Engaging and imaginative storytelling  ," I enjoy films that explore deep human emotions and complex relationships, as seen in titles like ""Farewell My Concubine"" and ""What Dreams May Come.""|  I appreciate movies that offer unique narratives and creative worlds, which is evident in my enjoyment of ""Being John Malkovich"" and ""Fantasia."""
 Thought-provoking dramas  |  Engaging narratives with a mix of humor and emotion  ," I enjoy films that explore complex themes and character development, as seen in titles like ""Burnt By the Sun"" and ""American History X.""|  I appreciate movies that balance light-hearted moments with deeper emotional stories, evident in films like ""Keeping the Faith"" and ""Guess Who's Coming to Dinner."""
 Thought-provoking dramas  |  Heartwarming and feel-good stories  ," I enjoy films that explore deep themes and complex characters, often tackling moral dilemmas and societal issues.|  I appreciate movies that evoke strong emotions and provide uplifting narratives, often centered around relationships and personal growth."
 Action and Adventure Enthusiast  |  Comedy and Quirky Storylines Lover  ," I enjoy thrilling action sequences and adventurous plots, as seen in movies like Die Hard and Star Wars: Episode VI - Return of the Jedi.|  I appreciate humor and unique narratives, which is reflected in my enjoyment of films like Raising Arizona and Better Off Dead."
 I enjoy a blend of drama and romance.  |  I appreciate films that combine elements of fantasy and adventure.  ," Many of the movies I rated highly, like ""Eat Drink Man Woman"" and ""Wings of Desire,"" showcase deep emotional narratives and complex relationships.|  My ratings for movies like ""Time Bandits"" and ""Wonderland"" reflect my enjoyment of imaginative storytelling and whimsical journeys."
 Eclectic mix of fantasy and drama  |  Appreciation for character-driven narratives  ," I enjoy films that blend imaginative storytelling with deep emotional narratives, as seen in titles like ""Willy Wonka and the Chocolate Factory"" and ""Requiem for a Dream.""|  I gravitate towards movies that focus on complex characters and their relationships, evident in films like ""Jesus' Son"" and ""Guess Who's Coming to Dinner."""
 Eclectic mix of comedy and drama  |  Appreciation for unique storytelling  ," I enjoy a blend of lighthearted comedies and thought-provoking dramas, as seen in my ratings for films like ""Mrs. Doubtfire"" and ""Midnight Cowboy.""|  I am drawn to films that offer unconventional narratives and artistic expression, reflected in my high ratings for movies like ""Eraserhead"" and ""Women on the Verge of a Nervous Breakdown."""
 I enjoy thought-provoking dramas and psychological thrillers.  |  I appreciate a mix of science fiction and horror elements.  ," My high ratings for films like ""Fight Club"" and ""Forrest Gump"" reflect my appreciation for complex narratives and character development.|  My enjoyment of ""Westworld"" and ""Nightmare on Elm Street"" shows that I am drawn to stories that explore futuristic concepts and psychological tension."
 I enjoy a mix of drama and thought-provoking narratives.  |  I appreciate a blend of classic and unconventional comedies.  ," My ratings reflect a preference for films that explore complex themes and character development, as seen in titles like ""Malcolm X"" and ""Trainspotting.""|  My history includes a variety of comedic styles, from the screwball humor of ""Bringing Up Baby"" to the satirical edge of ""Mystery Science Theater 3000: The Movie."""
 I enjoy a mix of science fiction and fantasy films.  |  I appreciate character-driven dramas and comedies.  ," My high ratings for movies like ""Earth Vs. the Flying Saucers"" and ""Yojimbo"" show my appreciation for imaginative storytelling and unique concepts.|  Films such as ""Clerks,"" ""Before Sunrise,"" and ""Defending Your Life"" highlight my preference for narratives that explore human relationships and personal growth."
 Thought-provoking dramas and character-driven narratives  |  Light-hearted comedies and feel-good stories  ," I enjoy films that explore deep themes and complex characters, as seen in titles like ""Burnt By the Sun"" and ""Dr. Strangelove.""|  I appreciate movies that provide humor and entertainment, such as ""Happy Gilmore"" and ""Can't Hardly Wait."""
 Dark Comedy Enthusiast  |  Thought-Provoking Sci-Fi Lover  ," I enjoy films that blend humor with darker themes, as seen in titles like ""South Park: Bigger, Longer and Uncut"" and ""Being John Malkovich.""|  I appreciate movies that challenge perceptions of reality and explore complex ideas, reflected in my high ratings for ""Twelve Monkeys"" and ""Pi."""
 I enjoy action-packed fantasy films.  |  I appreciate dark comedies with a unique twist.  ," My high ratings for movies like Army of Darkness reflect my preference for thrilling adventures that blend supernatural elements with intense action sequences.|  The films I rate highly often feature humor intertwined with darker themes, showcasing my taste for stories that balance levity and seriousness in unexpected ways."
 I enjoy a mix of science fiction and fantasy adventures.  |  I appreciate thought-provoking dramas and social commentaries.  ," I have rated highly films like ""Star Wars: Episode V - The Empire Strikes Back,"" ""Dune,"" and ""Galaxy Quest,"" which showcase imaginative worlds and thrilling narratives.|  My high ratings for movies such as ""Nineteen Eighty-Four,"" ""Do the Right Thing,"" and ""Life Is Beautiful (La Vita è bella)"" reflect my interest in stories that explore complex themes and human experiences."
 Eclectic mix of comedy and drama  |  Appreciation for classic and influential cinema  ," I enjoy films that blend humor with deeper emotional themes, as seen in my ratings for titles like ""A Fish Called Wanda"" and ""Crimes and Misdemeanors.""|  I gravitate towards films that have made a significant impact on the film industry, such as ""Raging Bull"" and ""Psycho,"" showcasing my interest in both storytelling and cinematic techniques."
 Emotional and Thought-Provoking Dramas  |  Engaging and Unique Storytelling  ," I enjoy films that explore deep emotional themes and complex characters, often leading to profound reflections on life and relationships.|  I appreciate movies that offer creative narratives and imaginative plots, often blending elements of fantasy, adventure, and historical contexts."
 Thought-provoking dramas  |  Engaging narratives with a blend of fantasy and reality  ," I enjoy films that explore complex themes and character development, as seen in titles like ""American Beauty"" and ""One Flew Over the Cuckoo's Nest.""|  I appreciate movies that mix imaginative storytelling with real-world elements, evident in films like ""Being There"" and ""Dark City."""
 Eclectic mix of dark comedies and dramas  |  Appreciation for international cinema and animation  ," I enjoy films that blend humor with serious themes, often featuring unique storytelling and complex characters.|  I am drawn to films from various cultures and animated features that offer imaginative narratives and artistic styles."
 Eclectic mix of drama and comedy  |  Appreciation for character-driven narratives  ," I enjoy films that blend emotional depth with humor, as seen in titles like ""Groundhog Day"" and ""Nurse Betty.""|  I gravitate towards movies that focus on complex characters and their journeys, evident in films like ""My Left Foot"" and ""Amadeus."""
 Romantic and Dramatic Storytelling  |  Engaging and Thought-Provoking Narratives  ," I enjoy films that explore deep emotional connections and complex relationships, as seen in titles like ""Titanic,"" ""Gone with the Wind,"" and ""Braveheart.""|  I appreciate movies that challenge my thinking and offer unique perspectives, which is reflected in my ratings for ""A Clockwork Orange,"" ""Fargo,"" and ""Psycho."""
 I enjoy epic historical dramas.  |  I gravitate towards intense and emotional narratives.  ," I appreciate films that depict significant historical events and feature strong character development, as seen in ""Braveheart.""|  I am drawn to stories that evoke deep feelings and explore complex themes, which is a hallmark of the movies I rate highly."
 Dark Comedy Enthusiast  |  Drama Aficionado  ," I enjoy films that blend humor with serious themes, as seen in ""South Park: Bigger, Longer and Uncut,"" which tackles social issues with satire.|  I appreciate intense storytelling and character-driven narratives, evident in my high ratings for ""Magnolia,"" ""Heavenly Creatures,"" and ""Basquiat,"" all of which explore complex human emotions and relationships."
 Romantic Comedies and Feel-Good Dramas  |  Classic and Timeless Stories  ," I enjoy movies that blend humor with heartfelt moments, often featuring love stories and uplifting themes.|  I appreciate films that have enduring narratives and strong character development, often set against historical or cultural backdrops."
 I enjoy a mix of heartfelt comedies and thought-provoking dramas.  |  I appreciate films that explore complex human relationships and social issues.  ," My ratings reflect a preference for films that balance humor with emotional depth, showcasing both lighthearted moments and serious themes.|  Many of the movies I've rated highly delve into personal connections and societal challenges, indicating my interest in narratives that provoke reflection and discussion."
 I enjoy films that blend drama with elements of surrealism and psychological depth.  |  I am drawn to character-driven narratives that explore human relationships and moral dilemmas.  ," My ratings reflect a preference for movies like ""Repulsion"" and ""Dancer in the Dark,"" which explore complex emotional landscapes and often challenge conventional storytelling.|  My high ratings for films such as ""Ghost,"" ""Pretty Woman,"" and ""Stand by Me"" indicate my appreciation for stories that delve into personal connections and the intricacies of life experiences."
 I enjoy a mix of science fiction and adventure films.  |  I appreciate films that blend drama with inspirational themes.  ," My high ratings for ""Space Cowboys"" and ""Pitch Black"" reflect my appreciation for imaginative storytelling and thrilling journeys in otherworldly settings.|  My positive ratings for ""Erin Brockovich,"" ""Willy Wonka and the Chocolate Factory,"" and ""Braveheart"" show my affinity for stories that highlight personal struggles and triumphs against adversity."
 I enjoy a mix of drama and romance.  |  I appreciate films with unique storytelling and artistic direction.  ," Many of the movies I rated highly, such as ""Dirty Dancing"" and ""American History X,"" showcase strong emotional narratives and character development.|  My ratings for movies like ""Stranger Than Paradise"" and ""Reservoir Dogs"" indicate my preference for innovative plots and distinctive cinematic styles."
 Thrilling Psychological and Sci-Fi Experiences  |  Engaging Adventure and Action Comedies  ," I enjoy movies that blend psychological tension with elements of science fiction, often exploring complex themes and human emotions.|  I appreciate films that combine adventure with humor, providing entertaining escapism while keeping the action lively and engaging."
 I enjoy a mix of drama and comedy.|  I am drawn to classic and thought-provoking narratives.," My ratings reflect a strong appreciation for films that blend emotional depth with humor, showcasing stories that resonate on multiple levels.|  Many of my favorite films are renowned for their storytelling and character development, often exploring complex themes and moral dilemmas."
 Thrilling and suspenseful narratives  |  Engaging character-driven dramas  ," I enjoy movies that keep me on the edge of my seat, blending elements of horror and psychological tension, as seen in titles like ""What Lies Beneath"" and ""A Nightmare on Elm Street.""|  I appreciate films that explore deep emotional journeys and complex characters, which is evident in my favorites like ""Forrest Gump"" and ""Fight Club."""
 I enjoy thought-provoking dramas and psychological thrillers.  |  I appreciate international cinema and unique storytelling styles.  ," Many of the films I rated highly, like ""Frankenstein,"" ""Peeping Tom,"" and ""Murder, My Sweet,"" delve into complex characters and moral dilemmas, showcasing my preference for narratives that challenge the mind.|  My high ratings for films such as ""Ran,"" ""Seven Samurai,"" and ""Antonia's Line"" reflect my interest in diverse cultural perspectives and innovative filmmaking techniques."
 I enjoy a mix of whimsical and thought-provoking films.  |  I appreciate films that blend drama with social commentary.  ," My ratings reflect a love for both light-hearted, imaginative stories like ""Mary Poppins"" and ""Toy Story,"" as well as deeper, introspective narratives such as ""Crimes and Misdemeanors"" and ""Raging Bull.""|  I tend to rate highly movies that explore complex themes and human experiences, as seen in titles like ""On the Waterfront,"" ""Bonnie and Clyde,"" and ""East of Eden."""
 I enjoy a mix of drama and dark comedy.  |  I appreciate thought-provoking and artistic cinema.  ," My ratings reflect a preference for films that explore complex emotions and societal issues, often with a satirical or humorous twist.|  I tend to rate highly films that are visually striking and narratively rich, showcasing unique storytelling and character development."
