taste,reason
 Heartwarming and feel-good narratives  |  Light-hearted adventure and comedy  ," I enjoy movies that evoke strong emotions and often feature uplifting stories, as seen in titles like ""Driving Miss Daisy"" and ""You've Got Mail.""|  I appreciate films that blend humor with adventure, which is evident in my enjoyment of ""Crocodile Dundee"" and ""Top Gun."""
 Enjoys a blend of whimsical and comedic storytelling  |  Prefers heartwarming narratives with a touch of nostalgia  ," I appreciate films that combine humor with imaginative elements, as seen in titles like ""Fantasia,"" ""Labyrinth,"" and ""Monty Python's Life of Brian.""|  I gravitate towards movies that evoke feelings of warmth and nostalgia, such as ""Lady and the Tramp,"" ""Winnie the Pooh and the Blustery Day,"" and ""A Christmas Story."""
 Emotional and Thought-Provoking Dramas  |  Whimsical and Imaginative Adventures  ," I enjoy films that explore deep emotional themes and complex characters, often leading to introspective moments and impactful storytelling.|  I appreciate movies that transport me to fantastical worlds and offer unique narratives, blending elements of fantasy and creativity with engaging plots."
 Eclectic mix of drama and comedy  |  Appreciation for international and independent cinema  ," I enjoy films that blend emotional depth with humor, as seen in titles like ""My Man Godfrey"" and ""Kingpin.""|  I gravitate towards unique storytelling and diverse perspectives, evident in my enjoyment of ""Wings of Desire"" and ""Paris Is Burning."""
 Emotional and thought-provoking dramas  |  Whimsical and imaginative storytelling  ," I enjoy films that explore deep emotional themes and complex character relationships, as seen in titles like ""Dancer in the Dark"" and ""Immortal Beloved.""|  I appreciate movies that blend fantasy with reality, offering unique narratives and visual experiences, such as ""FairyTale: A True Story"" and ""Creature Comforts."""
 Eclectic mix of drama and dark comedy  |  Appreciation for thought-provoking and unconventional storytelling  ," I enjoy films that blend intense emotional narratives with elements of humor, as seen in titles like ""Dancer in the Dark"" and ""So I Married an Axe Murderer.""|  I gravitate towards movies that challenge traditional narratives and explore unique themes, evident in my favorites like ""Koyaanisqatsi"" and ""Trainspotting."""
 Emotional dramas with strong character development  |  Epic narratives with historical or fantastical elements  ," I enjoy films that explore deep emotional themes and showcase complex characters, as seen in titles like ""Dead Man Walking"" and ""Philadelphia.""|  I appreciate grand storytelling that combines history and adventure, which is evident in movies like ""Braveheart"" and ""E.T. the Extra-Terrestrial."""
 Romantic Comedies and Feel-Good Dramas  |  Family-Friendly Adventures  ," I enjoy movies that blend romance with humor and uplifting narratives, as seen in titles like ""Pretty Woman"" and ""Forrest Gump.""|  I appreciate films that are suitable for all ages and often feature heartwarming stories, like ""Lady and the Tramp"" and ""Crocodile Dundee."""
 Eclectic mix of comedy and drama  |  Appreciation for international cinema  ," I enjoy films that blend humor with deeper emotional narratives, as seen in titles like ""Midnight Run"" and ""Of Mice and Men.""|  I am drawn to diverse storytelling styles and cultural perspectives, evident in my enjoyment of films like ""Tampopo"" and ""Chungking Express."""
 I enjoy a blend of drama and dark comedy.  |  I appreciate thought-provoking science fiction and fantasy.  ," My ratings reflect a preference for films that explore complex human emotions and relationships, often with a satirical or humorous twist.|  I tend to favor movies that challenge reality and imagination, showcasing unique narratives and innovative concepts."
 Eclectic mix of drama and social commentary  |  Appreciation for international cinema and unique storytelling  ," I enjoy films that explore complex human emotions and societal issues, as seen in titles like ""Princess Mononoke"" and ""Citizen Ruth.""|  I am drawn to films from various cultures and unconventional narratives, evident in my ratings for ""Vagabond"" and ""Red Sorghum."""
 I enjoy a mix of drama and dark comedy.  |  I appreciate classic thrillers and crime dramas.  ," My ratings reflect a preference for films that explore complex characters and situations, often blending serious themes with humor.|  Many of the movies I've rated highly feature suspenseful plots and intricate storytelling, showcasing my interest in tension-filled narratives."
 Eclectic mix of drama and thought-provoking narratives  |  Appreciation for unique storytelling and unconventional plots  ," I enjoy films that explore deep emotional themes and complex characters, as seen in titles like ""Mo' Better Blues"" and ""Burnt By the Sun.""|  I am drawn to movies that offer fresh perspectives and innovative narratives, evident in my enjoyment of ""Fast, Cheap & Out of Control"" and ""Stalker."""
 I enjoy a mix of drama and romance films.  |  I appreciate classic and cult comedies.  ," Many of the movies I rated highly feature strong emotional narratives and character-driven stories, often exploring relationships and personal growth.|  My ratings reflect a fondness for films that blend humor with unique storytelling, showcasing both timeless comedic elements and offbeat charm."
 Romantic Comedies and Dramas  |  Classic and Thought-Provoking Cinema  ," I enjoy films that blend humor with heartfelt moments, often featuring love stories and relatable characters, as seen in titles like ""Pretty Woman"" and ""Notting Hill.""|  I appreciate movies that offer deep narratives and strong performances, such as ""Gone with the Wind"" and ""Lawrence of Arabia,"" which provoke thought and evoke strong emotions."
 I enjoy thought-provoking dramas and intense narratives.  |  I have a fondness for adventurous and imaginative films.  ," My ratings for films like ""Requiem for a Dream,"" ""Breaking the Waves,"" and ""12 Angry Men"" reflect my appreciation for deep storytelling and complex character development.|  My high ratings for movies such as ""2001: A Space Odyssey,"" ""Toy Story,"" and ""Raiders of the Lost Ark"" indicate my love for creative storytelling and engaging visual experiences."
 Emotional drama with strong character development  |  Thought-provoking narratives with social commentary  ," I enjoy films that explore deep emotional themes and showcase the complexities of human relationships, as seen in ""Forrest Gump"" and ""American Beauty.""|  I appreciate movies that challenge societal norms and provoke reflection on contemporary issues, which is a common thread in both ""Forrest Gump"" and ""American Beauty."""
 I enjoy dark fantasy and horror-comedy films.  |  I appreciate cult classics and unique storytelling.  , My high ratings for movies like Army of Darkness indicate a preference for stories that blend supernatural elements with humor and adventure.|  My affinity for films like Army of Darkness suggests I gravitate towards movies that have a dedicated fan base and offer unconventional narratives.
 Eclectic mix of drama and art-house films  |  Interest in international and independent cinema  ," I enjoy films that explore deep emotional narratives and unique storytelling techniques, often found in dramas and art-house cinema.|  I appreciate diverse perspectives and cultural narratives, which are often showcased in international and independent films."
 I enjoy a mix of comedy and drama.|  I favor classic and thought-provoking cinema.," My ratings reflect a strong appreciation for films that blend humor with serious themes, showcasing my preference for stories that provoke thought while entertaining.|  Many of the movies I rated highly are renowned for their artistic merit and storytelling depth, indicating my inclination towards films that challenge conventional narratives and explore complex characters."
 Eclectic mix of drama and comedy  |  Appreciation for international cinema  ," I enjoy films that blend emotional depth with humor, as seen in titles like ""My Man Godfrey"" and ""Nashville.""|  I am drawn to films from different cultures, such as ""Man and a Woman"" and ""Mifune,"" which showcase unique storytelling styles."
 I enjoy a mix of intense dramas and thought-provoking narratives.  |  I appreciate films that blend action with strong storytelling.  ," My ratings reflect a preference for films that explore deep emotional themes and complex characters, such as ""Taxi Driver"" and ""Paths of Glory.""|  I tend to rate highly movies like ""Gladiator"" and ""Pulp Fiction,"" which combine thrilling sequences with engaging plots and memorable dialogue."
 I enjoy a mix of drama and romance.|  I appreciate films with unique storytelling and unconventional themes.," Many of the movies I rated highly, such as ""Mansfield Park"" and ""Love Affair,"" showcase strong emotional narratives and character development.|  My ratings for movies like ""Vanya on 42nd Street"" and ""Mystery Science Theater 3000: The Movie"" reflect my interest in innovative plots and creative approaches to filmmaking."
 I enjoy a mix of adventure and science fiction films.  |  I appreciate heartfelt dramas and comedies.  ," My ratings reflect a strong appreciation for movies like ""Star Wars: Episode VI - Return of the Jedi"" and ""Star Trek: First Contact,"" which showcase thrilling journeys and imaginative worlds.|  I have rated films such as ""Stand by Me,"" ""Driving Miss Daisy,"" and ""Almost Famous"" highly, indicating my enjoyment of stories that explore human relationships and evoke strong emotions."
 I enjoy character-driven dramas and thought-provoking narratives.  |  I appreciate films that blend humor with serious themes.  ," Many of the films I rated highly, such as ""To Kill a Mockingbird"" and ""Midnight Express,"" focus on deep emotional themes and complex characters.|  Movies like ""M*A*S*H"" and ""Flirting With Disaster"" showcase my preference for stories that balance comedic elements with more profound messages."
 Dark Comedy Enthusiast  |  Absurdist and Satirical Film Lover  ," I enjoy films that blend humor with darker themes, as seen in titles like ""Heathers"" and ""South Park: Bigger, Longer and Uncut.""|  I appreciate movies that use absurdity and satire to critique society, which is evident in ""American Movie"" and ""Rosencrantz and Guildenstern Are Dead."""
 I enjoy thought-provoking dramas and existential films.  |  I appreciate engaging narratives with a mix of humor and adventure.  ," Many of the movies I rated highly, like ""Seventh Seal"" and ""Trial, The,"" explore deep philosophical themes and complex human emotions.|  Films such as ""Bringing Up Baby"" and ""Casino"" showcase my preference for stories that blend comedic elements with thrilling plots."
 Eclectic mix of comedy and drama  |  Appreciation for thought-provoking narratives  ," I enjoy a blend of humor and emotional storytelling, as seen in films like ""Young Frankenstein"" and ""From Here to Eternity.""|  I gravitate towards films that challenge conventional storytelling, such as ""Pulp Fiction"" and ""Blade Runner."""
 I enjoy a blend of comedy and drama.  |  I am drawn to thought-provoking and unconventional storytelling.  ," My ratings reflect a strong appreciation for films that balance humor with deeper emotional narratives, as seen in titles like ""Monty Python and the Holy Grail"" and ""It's a Wonderful Life.""|  I favor films that challenge traditional narratives and explore unique concepts, evident in my high ratings for ""Being John Malkovich"" and ""Dark City."""
 I enjoy a mix of drama and fantasy films.  |  I have a preference for thought-provoking and character-driven stories.  ," My ratings reflect a strong appreciation for emotionally rich narratives and imaginative storytelling, as seen in titles like ""Fanny and Alexander"" and ""E.T. the Extra-Terrestrial.""|  I tend to rate highly films that explore complex themes and human experiences, such as ""Raging Bull"" and ""Moonstruck."""
 I enjoy a mix of comedy and drama.  |  I appreciate unconventional storytelling and unique narratives.  ," My ratings reflect a preference for films that blend humor with deeper emotional themes, such as ""South Park: Bigger, Longer and Uncut"" and ""12 Angry Men.""|  I tend to rate films like ""Drugstore Cowboy"" and ""Willy Wonka and the Chocolate Factory"" highly, indicating a liking for innovative plots and distinctive characters."
 I enjoy heartwarming dramas and feel-good stories.  |  I have a preference for adventurous and action-packed films.  ," My high ratings for films like ""Driving Miss Daisy"" and ""Gone with the Wind"" reflect my appreciation for narratives that explore human relationships and emotional journeys.|  My enjoyment of movies such as ""Top Gun,"" ""Crocodile Dundee,"" and ""Hang 'em High"" indicates that I am drawn to thrilling plots and dynamic characters that offer excitement and entertainment."
 Emotional and Thought-Provoking Dramas  |  Whimsical and Imaginative Stories  ," I enjoy films that explore deep emotional themes and complex characters, as seen in titles like ""Schindler's List"" and ""Harold and Maude.""|  I appreciate movies that blend fantasy and creativity, such as ""It's a Wonderful Life"" and ""Beetlejuice,"" which offer unique perspectives and imaginative storytelling."
 Dark satirical comedies  |  Thought-provoking sci-fi  ," I enjoy films that blend humor with serious themes, as seen in ""Dr. Strangelove"" and ""Heathers.""|  I appreciate movies that challenge perceptions of reality and humanity, like ""Blade Runner"" and ""Pi."""
 Emotional dramas with strong character development  |  Historical and epic narratives  ," I enjoy films that explore deep emotional themes and showcase complex characters, as seen in titles like ""Dead Man Walking"" and ""Forrest Gump.""|  I am drawn to movies that depict significant historical events or epic tales, which is evident in my appreciation for ""Braveheart"" and ""Robin Hood: Prince of Thieves."""
 Romantic Comedies and Dramas  |  Thought-Provoking and Artistic Films  ," I enjoy films that explore relationships and emotional connections, as seen in titles like ""10 Things I Hate About You,"" ""Hairspray,"" and ""True Romance.""|  I appreciate movies that challenge perspectives and offer deep narratives, reflected in my ratings for ""Ghost in the Shell,"" ""Cinema Paradiso,"" and ""Three Colors: Red."""
 I enjoy a mix of heartfelt dramas and thought-provoking films.  |  I appreciate lighthearted comedies and family-friendly films.  ," My ratings reflect a preference for emotional storytelling and complex characters, as seen in movies like ""Sophie's Choice"" and ""One Flew Over the Cuckoo's Nest.""|  I tend to rate movies like ""Stuart Little,"" ""Beetlejuice,"" and ""Toy Story"" highly, indicating my enjoyment of humor and feel-good narratives."
 Emotional and thought-provoking dramas  |  Engaging narratives with unique storytelling  ," I enjoy films that explore deep human experiences and complex relationships, as seen in titles like ""Paths of Glory"" and ""Central Station.""|  I appreciate movies that offer distinctive perspectives and innovative plots, reflected in my ratings for ""Smoke"" and ""Night on Earth."""
 Thought-provoking dramas and character-driven narratives  |  Engaging documentaries and biographical films  ," I enjoy films that explore complex themes and deep character development, as seen in titles like ""Seven Samurai"" and ""To Live.""|  I appreciate real-life stories and insightful perspectives, which is reflected in my enjoyment of ""Maya Lin: A Strong Clear Vision"" and ""Wonderful, Horrible Life of Leni Riefenstahl."""
 I enjoy a mix of drama and thought-provoking narratives.  |  I appreciate unique storytelling and artistic expression.  ," Many of the films I rated highly, like ""Richard III"" and ""Of Mice and Men,"" showcase deep character development and complex themes.|  Movies such as ""Umbrellas of Cherbourg"" and ""Ghost in the Shell"" reflect my interest in innovative visuals and unconventional plots."
 I enjoy thought-provoking dramas and comedies.  |  I appreciate international cinema and unique storytelling.  ," My ratings reflect a preference for films that blend emotional depth with humor, showcasing complex characters and relatable situations.|  My high ratings for films like ""All About My Mother"" and ""Women on the Verge of a Nervous Breakdown"" indicate a fondness for diverse cultural perspectives and innovative narratives."
 I enjoy films that blend drama with elements of romance and existential themes.  |  I am drawn to classic suspense and psychological thrillers.  ," My high ratings for movies like ""Harold and Maude"" and ""American Beauty"" reflect my appreciation for character-driven narratives that explore complex human emotions and relationships.|  My ratings for films such as ""Psycho"" and ""Rear Window"" indicate my interest in stories that build tension and provoke thought through intricate plots and strong character development."
 Romantic and Heartwarming Films  |  Engaging Dramas and Thrillers  ," I enjoy movies that evoke strong emotions and often feature love stories, as seen in titles like ""Mary Poppins,"" ""Grace of My Heart,"" and ""Lady and the Tramp.""|  I appreciate films that offer intense narratives and thought-provoking themes, which is reflected in my favorites like ""Psycho,"" ""Requiem for a Dream,"" and ""Stand and Deliver."""
 Eclectic mix of drama and dark comedy  |  Appreciation for psychological thrillers and horror  ," I enjoy films that blend serious themes with humor, as seen in titles like ""My Cousin Vinny"" and ""Bringing Up Baby.""|  I am drawn to intense narratives that explore the human psyche, evident in my high ratings for ""Rosemary's Baby"" and ""Blue Velvet."""
 I enjoy thought-provoking science fiction and fantasy films.  |  I appreciate emotionally impactful dramas and animated films.  ," My ratings for movies like ""2001: A Space Odyssey,"" ""Star Wars: Episode IV - A New Hope,"" and ""Princess Mononoke"" indicate a strong appreciation for imaginative storytelling and complex themes.|  My high ratings for titles such as ""Children of Heaven,"" ""Farewell My Concubine,"" and ""Fantasia"" suggest that I am drawn to narratives that evoke deep feelings and showcase artistic expression."
 Eclectic mix of drama and dark comedy  |  Appreciation for thought-provoking and surreal storytelling  ," I enjoy films that blend emotional depth with humor, often exploring complex themes and character-driven narratives.|  I am drawn to movies that challenge conventional narratives and provoke deeper reflection, often featuring unique visual styles and imaginative plots."
 I enjoy quirky comedies with a cult following.  |  I appreciate dark fantasy and horror-comedy blends.  ," Movies like ""Clerks"" showcase unique humor and relatable characters, which resonate with my taste for offbeat storytelling.|  ""Army of Darkness"" combines elements of horror with humor, reflecting my interest in films that mix genres for a fun and thrilling experience."
 Thought-provoking dramas  |  Romantic and whimsical narratives  ," I enjoy films that explore complex themes and character development, as seen in titles like ""Malcolm X"" and ""Twelve Monkeys.""|  I appreciate movies that blend romance with a touch of whimsy, such as ""Annie Hall"" and ""Like Water for Chocolate."""
 Eclectic mix of animated and live-action storytelling  |  Interest in thought-provoking and genre-blending narratives  ," I enjoy both animated films like ""Winnie the Pooh and the Blustery Day"" and live-action classics such as ""To Kill a Mockingbird,"" showcasing my appreciation for varied storytelling styles.|  I gravitate towards films that combine elements of drama, horror, and fantasy, as seen in titles like ""Event Horizon"" and ""Princess Mononoke,"" reflecting my preference for complex themes and imaginative worlds."
 Eclectic mix of comedy and drama  |  Appreciation for international and thought-provoking cinema  ," I enjoy films that blend humor with deeper emotional narratives, as seen in titles like ""Funny Bones"" and ""Of Mice and Men.""|  I am drawn to films that explore cultural themes and social issues, evident in my high ratings for ""Land and Freedom"" and ""The Conformist."""
 Emotional dramas with strong character development  |  Thought-provoking narratives with a touch of humor  ," I enjoy films that explore deep emotional themes and showcase complex relationships, as seen in ""Men Don't Leave.""|  I appreciate movies that blend serious topics with light-hearted moments, creating a balance that keeps me engaged."
 Thought-provoking science fiction and drama  |  Engaging character-driven narratives  ," I enjoy films that explore complex themes and human experiences, as seen in titles like ""2001: A Space Odyssey"" and ""My Left Foot.""|  I appreciate stories that focus on deep character development and emotional journeys, reflected in movies like ""L.A. Confidential"" and ""Fargo."""
 Thrilling and suspenseful narratives  |  Engaging science fiction and adventure  ," I enjoy movies that keep me on the edge of my seat, often featuring elements of mystery and tension, as seen in titles like ""What Lies Beneath"" and ""Jaws.""|  I appreciate films that explore imaginative concepts and adventurous journeys, which is reflected in my enjoyment of ""2001: A Space Odyssey"" and ""Close Encounters of the Third Kind."""
 I enjoy a mix of drama and dark comedy.  |  I appreciate classic thrillers and suspenseful narratives.  ," Many of my favorite films, like ""Pulp Fiction"" and ""Annie Hall,"" blend serious themes with humor, showcasing complex characters and situations.|  Movies such as ""Seven (Se7en)"" and ""Double Indemnity"" highlight my preference for gripping plots and psychological tension that keep me on the edge of my seat."
 I enjoy a mix of drama and comedy.|  I have a preference for engaging narratives with strong character development.," My ratings reflect a strong appreciation for films that blend emotional depth with humor, as seen in titles like ""Annie Hall"" and ""Fried Green Tomatoes.""|  Many of the movies I rated highly, such as ""Schindler's List"" and ""Sense and Sensibility,"" showcase intricate storytelling and well-crafted characters."
 I enjoy a mix of action and adventure films.  |  I appreciate character-driven dramas and thought-provoking stories.  ," My ratings for movies like ""Mad Max Beyond Thunderdome,"" ""Star Wars: Episode IV - A New Hope,"" and ""Back to the Future"" reflect my preference for thrilling narratives and engaging plots.|  Films such as ""Malcolm X,"" ""All About My Mother,"" and ""Secrets & Lies"" showcase my interest in deep, emotional narratives that explore complex themes and relationships."
 I enjoy a mix of drama and thought-provoking narratives.  |  I appreciate a blend of comedy and adventure.  ," Many of the films I rated highly, like ""Citizen Kane"" and ""Schindler's List,"" are known for their deep storytelling and emotional impact.|  My ratings for movies like ""Galaxy Quest"" and ""Chicken Run"" show that I enjoy light-hearted films that also deliver engaging plots and humor."
 I enjoy thought-provoking dramas and character-driven narratives.  |  I appreciate quirky comedies and unique storytelling.  ," Many of the films I rated highly, such as ""Boys Don't Cry"" and ""Miller's Crossing,"" focus on complex characters and emotional depth.|  My ratings for films like ""Duck Soup"" and ""Rosencrantz and Guildenstern Are Dead"" reflect my enjoyment of humor that challenges conventions and offers a fresh perspective."
 Family-friendly animated films  |  Fantasy and adventure films  ," I enjoy movies like ""Beauty and the Beast"" and ""Mulan,"" which feature engaging stories and memorable characters suitable for all ages.|  I appreciate films like ""E.T. the Extra-Terrestrial"" and ""Dracula: Dead and Loving It,"" which offer imaginative plots and thrilling escapades."
 Romantic and Dramatic Storytelling  |  Family-Friendly and Heartwarming Adventures  ," I enjoy films that explore deep emotional connections and relationships, as seen in titles like ""You've Got Mail"" and ""Breaking the Waves.""|  I appreciate movies that evoke nostalgia and warmth, such as ""Old Yeller,"" ""Bambi,"" and ""101 Dalmatians,"" which resonate with themes of love and companionship."
 Emotional and thought-provoking dramas  |  Engaging and imaginative storytelling  ," I enjoy films that explore deep human experiences and complex relationships, as seen in titles like ""Sophie's Choice"" and ""Raise the Red Lantern.""|  I appreciate movies that offer unique narratives and creative visuals, reflected in my enjoyment of ""Princess Mononoke"" and ""Little Nemo: Adventures in Slumberland."""
 Emotional and Thought-Provoking Dramas  |  Classic and Innovative Comedies  ," I enjoy films that explore deep emotional themes and complex character relationships, as seen in titles like ""Scent of a Woman,"" ""Gandhi,"" and ""A Man for All Seasons.""|  I appreciate a blend of classic humor and innovative storytelling, which is evident in my enjoyment of films like ""Modern Times,"" ""City Lights,"" and ""Easy Rider."""
