taste,reason
 I enjoy thought-provoking dramas and historical narratives.  |  I appreciate imaginative and whimsical storytelling.  ," My high ratings for films like ""A Man for All Seasons,"" ""From Here to Eternity,"" and ""Saving Private Ryan"" reflect my appreciation for stories that explore complex human experiences and significant historical events.|  My enjoyment of movies such as ""Fantasia,"" ""Enchanted April,"" and ""What Dreams May Come"" indicates that I am drawn to films that blend fantasy with emotional depth and creativity."
 I enjoy a mix of drama and comedy.  |  I am drawn to thought-provoking and artistic films.  ," My ratings reflect a strong appreciation for films that balance emotional depth with humor, such as ""Driving Miss Daisy"" and ""Annie Hall.""|  I tend to rate highly movies that challenge conventional storytelling and explore complex themes, like ""Wings of Desire"" and ""Children of Paradise."""
 Eclectic mix of drama and fantasy  |  Appreciation for psychological thrillers and horror  ," I enjoy films that blend emotional storytelling with imaginative elements, as seen in titles like ""Sweet and Lowdown"" and ""Little Nemo: Adventures in Slumberland.""|  I am drawn to intense narratives that explore the darker aspects of human nature, evident in my ratings for ""Hellraiser"" and ""In the Mouth of Madness."""
 I enjoy thought-provoking dramas and biographical films.  |  I appreciate unique and unconventional storytelling.  ," My high ratings for movies like ""I Shot Andy Warhol"" and ""Once Were Warriors"" reflect my appreciation for deep narratives and character-driven stories.|  Films such as ""Crumb"" and ""It Conquered the World"" showcase my interest in innovative plots and distinctive perspectives."
 I enjoy character-driven dramas and thought-provoking narratives.  |  I appreciate films that blend humor with social commentary.  ," Many of the movies I rated highly, such as ""Driving Miss Daisy,"" ""12 Angry Men,"" and ""Midnight Cowboy,"" focus on deep character development and explore complex themes.|  My ratings for movies like ""Animal House,"" ""Almost Famous,"" and ""American Graffiti"" reflect my enjoyment of comedies that also provide insights into society and culture."
 Emotional and thought-provoking dramas  |  Engaging and unique storytelling  ," I enjoy films that explore deep human experiences and complex relationships, as seen in titles like ""American History X"" and ""To Kill a Mockingbird.""|  I appreciate movies that offer fresh perspectives and inventive narratives, which is evident in my enjoyment of films like ""Buena Vista Social Club"" and ""Everything You Always Wanted to Know About Sex."""
 I enjoy thought-provoking dramas and emotional narratives.  |  I appreciate a mix of fantasy and unique storytelling.  ," Many of the films I rated highly, such as ""American History X"" and ""Brief Encounter,"" explore deep themes and complex characters, reflecting my preference for stories that challenge and engage me emotionally.|  My ratings for films like ""Dark City"" and ""Brazil"" indicate that I am drawn to imaginative plots and creative worlds, showcasing my interest in movies that push the boundaries of conventional storytelling."
 I enjoy thought-provoking dramas and psychological thrillers.  |  I appreciate classic and innovative storytelling in cinema.  ," My high ratings for films like ""One Flew Over the Cuckoo's Nest,"" ""Raging Bull,"" and ""Strangers on a Train"" reflect my appreciation for complex characters and intense narratives.|  My enthusiasm for movies such as ""Citizen Kane,"" ""Bringing Up Baby,"" and ""North by Northwest"" indicates my fondness for films that have shaped the art of filmmaking and offer unique perspectives."
 I enjoy a mix of horror and dark comedy.  |  I appreciate classic cinema and thought-provoking dramas.  ," My ratings for films like ""Night of the Living Dead"" and ""Love and Death on Long Island"" reflect my appreciation for both the suspense of horror and the humor found in darker themes.|  My high ratings for movies such as ""Citizen Kane"" and ""Taxi Driver"" indicate my interest in films that explore complex characters and societal issues through a cinematic lens."
 I enjoy thought-provoking dramas and comedies.  |  I appreciate classic and innovative storytelling in cinema.  ," My ratings reflect a preference for films that blend humor with deeper themes, showcasing complex characters and social commentary.|  I gravitate towards movies that are not only entertaining but also push the boundaries of narrative and style, often featuring unique perspectives and artistic expression."
 Enjoys a mix of drama and comedy  |  Prefers adventurous and thought-provoking narratives  ," I appreciate films that balance emotional depth with humor, as seen in my favorites like ""About Last Night..."" and ""Mr. Mom.""|  I am drawn to movies that offer excitement and intellectual engagement, evident in my love for ""Jurassic Park"" and ""Schindler's List."""
 I enjoy films with strong character-driven narratives.  |  I appreciate a blend of drama and unique storytelling.  ," Many of the movies I rated highly feature complex characters and emotional depth, such as ""All About Eve"" and ""My Fair Lady.""|  My ratings reflect a preference for films that combine dramatic elements with innovative plots, like ""Drugstore Cowboy"" and ""Delicatessen."""
 I enjoy thought-provoking dramas and comedies.  |  I appreciate classic and influential cinema.  ," My ratings reflect a preference for films that explore complex themes and character development, often blending humor with serious subject matter.|  Many of the movies I've rated highly are considered significant in film history, showcasing innovative storytelling and iconic performances."
 Engaging with thought-provoking dramas and character-driven narratives  |  Appreciating adventurous and imaginative storytelling  ," I enjoy films that explore complex themes and deep emotional journeys, as seen in titles like ""All About My Mother"" and ""Boys Don't Cry.""|  I am drawn to movies that offer unique worlds and thrilling experiences, evident in my love for ""Jurassic Park"" and ""Star Wars: Episode V - The Empire Strikes Back."""
 Emotional and Character-Driven Dramas  |  Unique and Quirky Independent Films  ," I enjoy films that explore deep emotional themes and complex character relationships, as seen in titles like ""Mildred Pierce,"" ""Ordinary People,"" and ""To Kill a Mockingbird.""|  I appreciate unconventional storytelling and unique perspectives, which is reflected in my enjoyment of movies like ""Fast, Cheap & Out of Control,"" ""American Movie,"" and ""Smoke Signals."""
 Thought-provoking dramas  |  Suspenseful thrillers  ," I enjoy films that delve into complex themes and moral dilemmas, as seen in titles like ""Seventh Seal"" and ""All the King's Men.""|  I appreciate movies that keep me on the edge of my seat, such as ""Rear Window"" and ""Notorious,"" which blend tension with engaging storytelling."
 I enjoy a mix of drama and dark comedy.  |  I appreciate classic and thought-provoking cinema.  ," My ratings reflect a preference for films that explore complex human emotions and societal issues, often with a satirical or poignant twist.|  I tend to favor movies that are not only entertaining but also challenge my perspective, featuring strong narratives and memorable characters."
 Eclectic mix of drama and animation  |  Appreciation for international cinema  ," I enjoy films that explore deep emotional narratives, as seen in titles like ""My Life in Pink"" and ""Watership Down,"" while also appreciating the creativity of animated works like ""Creature Comforts.""|  I gravitate towards films from various cultures, such as ""Antonia's Line"" and ""Tampopo,"" which showcase unique storytelling styles and perspectives beyond mainstream Hollywood."
 Animated and Family-Friendly Films  |  Thought-Provoking Dramas  ," I enjoy movies that are light-hearted and suitable for all ages, as seen in titles like ""Creature Comforts"" and ""Winnie the Pooh and the Blustery Day.""|  I appreciate films that explore complex themes and character development, which is evident in my high ratings for ""Breaking the Waves"" and ""Days of Heaven."""
 Eclectic mix of drama and romance  |  Appreciation for unique narratives and character-driven stories  ," I enjoy films that blend emotional storytelling with romantic elements, as seen in titles like ""All About Eve"" and ""Before Sunrise.""|  I gravitate towards films that offer unconventional plots and rich character development, evident in movies like ""Yojimbo"" and ""Chungking Express."""
 I enjoy a mix of drama and comedy films.  |  I am drawn to films with strong character development and engaging narratives.  ," My ratings reflect a strong appreciation for both heartfelt dramas like ""Erin Brockovich"" and lighthearted comedies such as ""There's Something About Mary.""|  Movies like ""Reservoir Dogs"" and ""Sleepless in Seattle"" showcase complex characters and compelling stories that resonate with me."
 Eclectic mix of drama and comedy  |  Appreciation for thought-provoking narratives  ," I enjoy films that blend emotional depth with humor, as seen in titles like ""Forrest Gump"" and ""Airplane!"".|  I gravitate towards movies that challenge conventional storytelling, such as ""Breaking the Waves"" and ""2001: A Space Odyssey""."
 I enjoy thought-provoking dramas and animated films.  |  I have a penchant for unique and unconventional storytelling.  ," My ratings reflect a strong appreciation for deep narratives and emotional storytelling, as seen in titles like ""Princess Mononoke"" and ""Once Were Warriors.""|  I gravitate towards films that offer distinctive perspectives and creative plots, evident in my high ratings for ""Tigrero: A Film That Was Never Made"" and ""Vagabond."""
 Thought-provoking dramas  |  Engaging adventure and fantasy  ," I enjoy films that explore deep themes and complex characters, often leading to introspection and emotional engagement.|  I appreciate movies that transport me to different worlds and offer thrilling narratives, often with a blend of imaginative storytelling and visual spectacle."
 Eclectic mix of drama and dark comedy  |  Appreciation for thought-provoking and unconventional narratives  ," I enjoy films that blend serious themes with humor, often exploring complex characters and situations, as seen in titles like ""Little Shop of Horrors"" and ""Office Space.""|  I am drawn to movies that challenge traditional storytelling, such as ""Pi"" and ""Dancer in the Dark,"" which offer unique perspectives and provoke deeper reflection."
 I enjoy heartfelt dramas with a touch of humor.  |  I appreciate films that explore the human condition and resilience.  ," Movies like ""Life Is Beautiful"" resonate with me due to their emotional depth and ability to blend poignant moments with lightheartedness.|  My high ratings reflect a preference for stories that delve into personal struggles and triumphs, showcasing the strength of the human spirit."
 Emotional and character-driven narratives  |  Eclectic mix of drama and unconventional storytelling  ," I enjoy films that explore deep emotional themes and complex character relationships, as seen in titles like ""The Flower of My Secret"" and ""Losing Isaiah.""|  I appreciate a variety of dramatic films that often feature unique plots and perspectives, which is evident in my ratings for movies like ""I Shot Andy Warhol"" and ""Relax... It's Just Sex."""
 Eclectic mix of drama and dark comedy  |  Appreciation for thought-provoking and artistic cinema  ," I enjoy films that blend emotional depth with humor, often exploring complex characters and situations, as seen in titles like ""Erin Brockovich"" and ""Fear and Loathing in Las Vegas.""|  I gravitate towards films that challenge conventional storytelling and offer unique perspectives, evident in my high ratings for ""Wings of Desire"" and ""Apocalypse Now."""
 I enjoy a mix of animated and family-friendly films.  |  I appreciate epic dramas and action-packed narratives.  ," My ratings for movies like ""Cinderella,"" ""My Fair Lady,"" and ""Mary Poppins"" reflect my appreciation for heartwarming stories that appeal to all ages.|  My high ratings for ""Braveheart,"" ""Top Gun,"" and ""Enemy of the State"" indicate my preference for films that feature intense storytelling and strong character arcs."
 I enjoy a blend of drama and character-driven narratives.  |  I appreciate films that mix humor with poignant themes.  ," Many of the movies I rated highly, such as ""Doctor Zhivago"" and ""Of Mice and Men,"" focus on deep emotional storytelling and complex characters.|  My ratings for movies like ""Clerks"" and ""Love and Basketball"" reflect my enjoyment of stories that balance lighthearted moments with serious undertones."
 Thought-provoking dramas with strong character development  |  Classic films with rich storytelling and historical context  ," I enjoy films that delve into complex human emotions and moral dilemmas, as seen in titles like ""To Kill a Mockingbird"" and ""American Beauty.""|  I appreciate movies that offer a glimpse into different eras and societal issues, exemplified by ""Casablanca"" and ""Gentleman's Agreement."""
 Action and Adventure Enthusiast  |  Emotional and Thought-Provoking Dramas  ," I enjoy films that feature thrilling action sequences and adventurous plots, as seen in titles like ""G.I. Jane,"" ""Blade Runner,"" and ""Ronin.""|  I appreciate movies that delve into deep emotional themes and complex characters, which is evident in my high ratings for ""Sophie's Choice,"" ""Boys Don't Cry,"" and ""Central Station."""
 Romantic Adventure Enthusiast  |  Historical Drama Aficionado  ," I enjoy films that blend romance with adventurous journeys, as seen in ""Around the World in 80 Days"" and ""Shakespeare in Love.""|  I appreciate stories that explore historical contexts and character-driven narratives, which are prominent in both ""Shakespeare in Love"" and the adventurous elements of ""Around the World in 80 Days."""
 Eclectic mix of drama and dark comedy  |  Appreciation for thought-provoking narratives  ," I enjoy films that blend serious themes with humor, as seen in titles like ""Boys Don't Cry"" and ""Dancer in the Dark.""|  I gravitate towards movies that explore complex ideas and human experiences, evident in films like ""What Dreams May Come"" and ""Vertigo."""
 Action and Comedy Enthusiast  |  Appreciation for Thought-Provoking Dramas  ," I enjoy films that blend thrilling action sequences with humor, as seen in my high ratings for movies like ""Blue Streak"" and ""Happy Gilmore.""|  I gravitate towards films that explore deep themes and complex narratives, evident in my ratings for titles like ""Mother Night"" and ""Koyaanisqatsi."""
 I enjoy thought-provoking dramas and intense narratives.  |  I appreciate unique storytelling and artistic expression.  ," My ratings reflect a preference for films that explore deep emotional themes and complex characters, such as ""Apocalypse Now,"" ""Sophie's Choice,"" and ""The Misérables.""|  I tend to favor films that offer unconventional narratives and striking visuals, as seen in titles like ""8 1/2,"" ""Wings of Desire,"" and ""Stranger Than Paradise."""
 Eclectic mix of comedy and drama  |  Appreciation for classic cinema and storytelling  ," I enjoy a blend of humor and emotional depth, as seen in my ratings for films like ""Romy and Michele's High School Reunion"" and ""Girl, Interrupted.""|  I favor films that showcase strong narratives and cinematic artistry, evident in my high ratings for titles like ""Chinatown"" and ""Sunset Blvd."""
 Eclectic mix of drama and comedy  |  Appreciation for international and independent cinema  ," I enjoy films that blend emotional depth with humor, as seen in titles like ""Grace of My Heart"" and ""Major Payne.""|  I gravitate towards unique storytelling and diverse perspectives, evident in my enjoyment of films like ""Indochine"" and ""To Live (Huozhe)."""
 Emotional and Character-Driven Dramas  |  Unique and Artistic Storytelling  ," I enjoy films that explore deep emotional themes and complex character relationships, as seen in titles like ""Losing Isaiah"" and ""Ruby in Paradise.""|  I appreciate movies that offer unconventional narratives and artistic visuals, which is evident in my enjoyment of ""Cold Fever"" and ""Nénette et Boni."""
 I enjoy heartwarming family films and animated classics.  |  I appreciate thought-provoking dramas and unique narratives.  ," My high ratings for movies like ""Old Yeller,"" ""101 Dalmatians,"" and ""Cinderella"" reflect my appreciation for stories that evoke nostalgia and emotional connections.|  My ratings for films such as ""Breaking the Waves,"" ""Gentleman's Agreement,"" and ""Inherit the Wind"" indicate that I gravitate towards movies that explore complex themes and character development."
 Eclectic mix of drama and comedy  |  Strong interest in character-driven narratives  ," I enjoy a blend of thought-provoking dramas like ""Citizen Kane"" and light-hearted comedies such as ""Meatballs,"" showcasing my appreciation for both emotional depth and humor.|  I gravitate towards films that focus on complex characters and their journeys, evident in titles like ""Searching for Bobby Fischer"" and ""Being There,"" which highlight personal growth and relationships."
 I enjoy thought-provoking dramas.  |  I appreciate suspenseful thrillers.  ," Many of the movies I've rated highly, like ""Harold and Maude"" and ""On the Waterfront,"" delve into complex themes and character development.|  Films such as ""Psycho"" and ""Rear Window"" showcase my preference for tension-filled narratives and psychological depth."
 Emotional and Thought-Provoking Dramas  |  Unique and Quirky Comedies  ," I enjoy films that explore deep emotional themes and complex characters, often highlighting human experiences and relationships.|  I appreciate movies that blend humor with unconventional storytelling, often featuring offbeat characters and situations that challenge traditional comedic norms."
 I enjoy a mix of drama and suspense films.  |  I am drawn to films that blend humor with thought-provoking themes.  ," My ratings reflect a strong appreciation for movies that explore deep emotional narratives and intense situations, such as ""American Beauty"" and ""Cape Fear.""|  I tend to rate highly movies that balance comedy with deeper messages, like ""Dr. Strangelove"" and ""Some Like It Hot."""
 I enjoy character-driven dramas and thought-provoking narratives.  |  I appreciate a blend of adventure and fantasy elements in storytelling.  ," My ratings reflect a preference for films that explore complex human emotions and relationships, such as ""Cyrano de Bergerac,"" ""Brief Encounter,"" and ""Almost Famous.""|  Many of my high-rated films, like ""Star Trek: The Motion Picture,"" ""Indiana Jones and the Temple of Doom,"" and ""E.T. the Extra-Terrestrial,"" showcase imaginative worlds and thrilling journeys."
 Eclectic appreciation for drama and character-driven narratives  |  Fondness for thought-provoking and artistic storytelling  ," I enjoy films that delve into complex characters and emotional depth, as seen in titles like ""My Left Foot"" and ""Barry Lyndon.""|  I gravitate towards movies that challenge conventional narratives and explore profound themes, evident in ""Repulsion"" and ""Children of Paradise."""
 Eclectic appreciation for international cinema  |  Fondness for animated and family-friendly films  ," I enjoy films from various cultures and countries, as seen in my ratings for titles like ""Lamerica,"" ""Pather Panchali,"" and ""World of Apu.""|  I have a strong liking for animated features and family-oriented stories, demonstrated by my high ratings for ""Aladdin and the King of Thieves"" and ""Goofy Movie, A."""
 Eclectic mix of drama and action  |  Appreciation for thought-provoking narratives  ," I enjoy films that combine intense character-driven narratives with thrilling action sequences, as seen in titles like ""Ghost in the Shell"" and ""Drunken Master.""|  I gravitate towards movies that challenge my perspective and provoke deeper thought, evident in my enjoyment of films like ""Cube"" and ""Murder, My Sweet."""
 I enjoy a mix of drama and comedy.  |  I am drawn to character-driven narratives.  ," My ratings reflect a strong appreciation for films that blend emotional depth with humor, showcasing stories that resonate on multiple levels.|  Many of the movies I rated highly focus on complex characters and their relationships, highlighting personal struggles and growth."
 Enjoys a mix of comedy and drama  |  Prefers engaging sci-fi and fantasy adventures  ," I appreciate films that blend humor with emotional depth, as seen in titles like ""Groundhog Day"" and ""Dead Poets Society.""|  I am drawn to imaginative storytelling and thrilling plots, evident in my enjoyment of ""Aliens"" and ""Toy Story 2."""
 I enjoy a mix of comedy and drama.  |  I appreciate adventure and classic storytelling.  ," My ratings reflect a preference for films that blend humor with emotional depth, such as ""There's Something About Mary"" and ""Erin Brockovich.""|  I tend to favor movies that feature engaging narratives and memorable characters, as seen in titles like ""Raiders of the Lost Ark"" and ""2001: A Space Odyssey."""
 I enjoy psychological thrillers and dramas.  |  I appreciate romantic comedies and feel-good films.  ," My high ratings for films like ""Psycho,"" ""L.A. Confidential,"" and ""Who's Afraid of Virginia Woolf?"" indicate a preference for intense narratives that explore complex characters and moral dilemmas.|  My enjoyment of titles such as ""Four Weddings and a Funeral,"" ""Shall We Dance?"" and ""Waiting for Guffman"" suggests that I gravitate towards lighthearted stories that blend humor with romance."
 I enjoy thought-provoking dramas and character-driven narratives.  |  I appreciate dark comedies and unconventional storytelling.  ," Many of the movies I rated highly, such as ""Schindler's List"" and ""American History X,"" focus on deep emotional themes and complex characters.|  Films like ""Waiting for Guffman"" and ""There's Something About Mary"" showcase my preference for humor that blends wit with unique, offbeat plots."
 Eclectic mix of animated and foreign films  |  Appreciation for thought-provoking dramas and comedies  ," I enjoy the artistry and storytelling in animated features like ""Princess Mononoke"" and appreciate the cultural depth found in foreign films like ""Buena Vista Social Club"" and ""Kundun.""|  I gravitate towards films that challenge perspectives, such as ""American History X"" and ""The Dinner Game,"" while also enjoying lighter, humorous takes on life like ""Spy Hard"" and ""Scrooged."""
 Thrilling and Intense Dramas  |  Engaging Psychological and Suspenseful Films  ," I enjoy movies that deliver gripping narratives and complex characters, often featuring high-stakes situations and moral dilemmas, as seen in titles like ""Apocalypse Now"" and ""GoodFellas.""|  I am drawn to films that explore the intricacies of the human mind and build tension, which is evident in my appreciation for movies like ""Fatal Attraction"" and ""Strangers on a Train."""
 Engaging dramas with strong narratives  |  Thrilling and adventurous experiences  ," I enjoy films that tell compelling stories and explore deep emotional themes, as seen in titles like ""Erin Brockovich"" and ""Schindler's List.""|  I appreciate movies that provide excitement and suspense, which is evident in my enjoyment of ""X-Men"" and ""Pitch Black."""
 Eclectic mix of drama and thought-provoking narratives  |  Appreciation for unique storytelling and cultural perspectives  ," I enjoy films that explore deep emotional themes and complex characters, often found in dramas and international cinema.|  I am drawn to movies that offer fresh viewpoints and innovative plots, particularly in independent and foreign films."
 Eclectic mix of dark comedies and dramas  |  Appreciation for international and independent cinema  ," I enjoy films that blend humor with serious themes, often exploring complex characters and moral dilemmas.|  I gravitate towards films that offer unique perspectives and storytelling styles, often found in foreign and indie productions."
 I enjoy a mix of crime dramas and dark comedies.  |  I appreciate thought-provoking documentaries and innovative storytelling.  ," My ratings reflect a preference for films that explore complex characters and moral dilemmas, often with a blend of humor and tension.|  I tend to favor films that challenge conventional narratives and provide insightful commentary on society and human experiences."
 Romantic Comedies and Feel-Good Dramas  |  Nostalgic and Uplifting Stories  ," I enjoy movies that blend humor with heartfelt moments, as seen in titles like ""You've Got Mail"" and ""Forrest Gump.""|  I appreciate films that evoke a sense of nostalgia and positivity, such as ""Big"" and ""Driving Miss Daisy,"" which highlight personal growth and meaningful relationships."
 I enjoy thought-provoking dramas and social commentaries.  |  I appreciate a mix of humor and poignant storytelling.  ," Many of the movies I rated highly, like ""Roger & Me"" and ""My Left Foot,"" tackle important societal issues and personal struggles, reflecting my interest in films that provoke reflection and discussion.|  Films such as ""Big Night"" and ""Sullivan's Travels"" showcase my preference for narratives that blend comedic elements with deeper emotional themes, making for a rich viewing experience."
