taste,reason
 Eclectic mix of dark comedies and thought-provoking dramas  |  Appreciation for unique storytelling and unconventional narratives  ," I enjoy films that blend humor with serious themes, often exploring complex characters and societal issues.|  I gravitate towards movies that offer fresh perspectives and innovative plots, often featuring quirky or offbeat characters."
 I enjoy a blend of suspenseful thrillers and light-hearted comedies.  |  I appreciate thought-provoking dramas and family-friendly adventures.  ," My high ratings for films like ""Dial M for Murder"" and ""His Girl Friday"" reflect my appreciation for tension and clever dialogue, while movies like ""Bambi"" and ""It's a Wonderful Life"" showcase my love for uplifting stories.|  My ratings for films such as ""On the Waterfront"" and ""All Quiet on the Western Front"" indicate my interest in deep, impactful narratives, while titles like ""Swiss Family Robinson"" and ""Peter Pan"" highlight my fondness for imaginative tales suitable for all ages."
 I enjoy a mix of drama and comedy.  |  I am drawn to thought-provoking narratives and social commentary.  ," My ratings reflect a strong appreciation for films that balance emotional depth with humor, as seen in titles like ""Young Frankenstein"" and ""To Kill a Mockingbird.""|  Many of my favorite films, such as ""12 Angry Men"" and ""Platoon,"" tackle significant themes and moral dilemmas, indicating my preference for movies that challenge perspectives."
 I enjoy sports dramas and comedies.  |  I appreciate animated films and action-packed adventures.  ," My high ratings for ""Hoosiers"" and ""Being John Malkovich"" reflect my appreciation for engaging stories that blend sports with emotional depth and humor.|  My enthusiasm for ""Toy Story 2"" and ""Die Hard"" shows that I enjoy both heartwarming animated narratives and thrilling action sequences."
 Eclectic mix of drama and fantasy  |  Appreciation for suspenseful thrillers and dark comedies  ," I enjoy films that blend emotional storytelling with imaginative elements, as seen in titles like ""Princess Mononoke"" and ""Life Is Beautiful.""|  I am drawn to movies that create tension and intrigue, such as ""Rear Window"" and ""Midnight Run,"" while also enjoying the humor found in films like ""M*A*S*H"" and ""Airheads."""
 I enjoy a mix of classic comedies and dark humor.  |  I appreciate intense dramas and psychological thrillers.  ," My ratings reflect a preference for films that blend humor with clever storytelling, often featuring quirky characters and satirical elements.|  I tend to favor films that explore complex themes and character motivations, often with suspenseful plots and emotional depth."
 Thought-provoking dramas  |  Unique storytelling and unconventional narratives  ," I enjoy films that explore complex themes and character development, as seen in titles like ""Malcolm X"" and ""Henry Fool.""|  I appreciate movies that offer innovative plots and styles, which is evident in my enjoyment of ""Rosencrantz and Guildenstern Are Dead"" and ""Lost Highway."""
 Action and Adventure Enthusiast  |  Historical Drama Aficionado  ," I enjoy films that feature thrilling action sequences and adventurous plots, as seen in ""Army of Darkness"" and ""Braveheart.""|  I appreciate movies that explore historical themes and epic narratives, which is evident in my high rating for ""Braveheart."""
 Emotional and Thought-Provoking Dramas  |  Engaging Thrillers and Mysteries  ," I enjoy films that explore deep human emotions and complex relationships, as seen in titles like ""Of Mice and Men,"" ""Before Sunrise,"" and ""Defending Your Life.""|  I am drawn to suspenseful narratives and intriguing plots, which is reflected in my appreciation for movies like ""Arlington Road,"" ""Cruel Intentions,"" and ""Casino."""
 I enjoy a blend of drama and psychological thrillers.  |  I have a penchant for thought-provoking international cinema.  ," My ratings reflect a strong appreciation for films that explore complex characters and intense emotional narratives, such as ""Nosferatu"" and ""A Face in the Crowd.""|  I gravitate towards films like ""Purple Noon"" and ""To Live,"" which offer unique cultural perspectives and deep storytelling."
 I enjoy a mix of comedy and drama.  |  I appreciate animated and family-friendly films.  ," My ratings reflect a strong appreciation for films that blend humor with emotional depth, such as ""Groundhog Day"" and ""Wonder Boys.""|  I have rated titles like ""Wallace & Gromit: The Best of Aardman Animation"" and ""Lady and the Tramp"" highly, indicating my enjoyment of animated stories that appeal to all ages."
 Whimsical and Heartwarming Stories  |  Thought-Provoking Dramas with Humor  ," I enjoy movies that blend fantasy and humor with emotional depth, as seen in titles like ""Willy Wonka and the Chocolate Factory"" and ""Bedknobs and Broomsticks.""|  I appreciate films that tackle serious themes while incorporating wit and charm, exemplified by ""Annie Hall"" and ""Men Don't Leave."""
 Eclectic mix of drama and character-driven narratives  |  Appreciation for international cinema and unique storytelling  ," I enjoy films that explore complex characters and emotional depth, often found in dramas like ""Jackie Brown"" and ""Gandhi.""|  I am drawn to films from various cultures and perspectives, as seen in titles like ""Central Station"" and ""The Garden of Finzi-Contini."""
 Action and War Enthusiast  |  Family-Friendly and Adventure Lover  ," I enjoy intense narratives and thrilling sequences, as seen in films like ""Saving Private Ryan"" and ""Air Force One,"" which combine action with compelling storytelling.|  I appreciate movies that blend adventure with heartwarming themes, evident in titles like ""Anastasia"" and ""Braveheart,"" which offer both excitement and emotional depth."
 Dramatic and Thought-Provoking Narratives  |  Unique and Innovative Storytelling  ," I enjoy films that explore deep emotional themes and complex characters, as seen in titles like ""Schindler's List,"" ""Requiem for a Dream,"" and ""To Kill a Mockingbird.""|  I appreciate movies that push boundaries and offer fresh perspectives, which is evident in my enjoyment of ""Ghost in the Shell,"" ""Brazil,"" and ""Time Bandits."""
 Comedy and Adventure Enthusiast  |  Sci-Fi and Drama Aficionado  ," I enjoy lighthearted films that combine humor with exciting journeys, as seen in titles like ""Dumb & Dumber"" and ""Flight of the Navigator.""|  I appreciate thought-provoking narratives and imaginative storytelling, which is evident in my enjoyment of ""Westworld"" and ""Close Encounters of the Third Kind."""
 I enjoy historical dramas and literary adaptations.  |  I appreciate films with strong emotional narratives and character development.  ," My high ratings for films like ""Henry V"" and ""East of Eden"" reflect my appreciation for stories rooted in history and classic literature.|  Movies such as ""Breaking Away"" and ""Philadelphia"" showcase my preference for deep, engaging stories that explore complex human experiences."
 Emotional and thought-provoking dramas  |  Quirky comedies and unique storytelling  ," I enjoy films that explore deep themes and complex characters, as seen in titles like ""Sophie’s Choice"" and ""Malcolm X.""|  I appreciate films that blend humor with originality, evident in movies like ""Waking Ned Devine"" and ""Heathers."""
 I enjoy a mix of comedy and drama.  |  I have a preference for classic and iconic films.  ," My ratings reflect a strong appreciation for films that blend humor with emotional depth, as seen in titles like ""Annie Hall"" and ""Best in Show.""|  I tend to rate highly films that are regarded as significant in cinema history, such as ""Raiders of the Lost Ark"" and ""Psycho."""
 Eclectic mix of drama and dark comedy  |  Appreciation for thought-provoking narratives  ," I enjoy films that blend intense emotional narratives with elements of humor, showcasing a range of human experiences and perspectives.|  I gravitate towards movies that challenge conventional storytelling, often exploring complex themes and moral dilemmas."
 Eclectic mix of drama and comedy  |  Appreciation for international cinema  ," I enjoy films that blend emotional depth with humor, as seen in titles like ""Grace of My Heart"" and ""Shall We Dance?"".|  I am drawn to diverse storytelling, reflected in my enjoyment of films like ""The Umbrellas of Cherbourg"" and ""To Live""."
 Romantic Comedies and Dramas  |  Thought-Provoking and Character-Driven Stories  ," I enjoy films that explore relationships and emotional connections, often with a blend of humor and heartfelt moments.|  I appreciate movies that delve into complex themes and showcase deep character development, often leading to introspective reflections."
 Emotional and Thought-Provoking Dramas  |  Whimsical and Imaginative Adventures  ," I enjoy films that delve into complex human emotions and relationships, often exploring themes of love, loss, and personal growth.|  I appreciate movies that transport me to fantastical worlds and offer a sense of wonder, often featuring unique storytelling and memorable characters."
 Romantic Comedies and Feel-Good Dramas  |  Classic and Timeless Stories  ," I enjoy movies that blend romance with humor and uplifting themes, as seen in titles like ""Pretty in Pink"" and ""You've Got Mail.""|  I appreciate films that tell enduring tales with strong characters, such as ""Gone with the Wind"" and ""Pretty Woman,"" which resonate across generations."
 Romantic and Thought-Provoking Dramas  |  Classic Comedies and Satirical Films  ," I enjoy films that explore deep emotional connections and complex relationships, often with a blend of romance and social commentary.|  I appreciate humor that combines wit and satire, often reflecting on societal norms and human behavior, making me laugh while also prompting deeper reflection."
 I enjoy a mix of animated and family-friendly films.  |  I have a strong preference for thought-provoking dramas and character-driven narratives.  ," My high ratings for movies like ""Chicken Run,"" ""Toy Story 2,"" and ""L.A. Story"" show that I appreciate light-hearted stories that appeal to both children and adults.|  My ratings for films such as ""Fight Club,"" ""Good Will Hunting,"" and ""Boys Don't Cry"" indicate that I am drawn to complex themes and deep emotional experiences in storytelling."
 Eclectic mix of drama and comedy  |  Appreciation for international cinema  ," I enjoy films that blend serious themes with humor, showcasing a range of emotional experiences.|  I gravitate towards films from different cultures, reflecting diverse storytelling styles and perspectives."
 Eclectic mix of drama and dark comedy  |  Appreciation for international and independent cinema  ," I enjoy films that blend emotional depth with humor, often exploring complex characters and societal issues.|  I gravitate towards films that offer unique perspectives and storytelling styles, often found in foreign and indie productions."
 Eclectic mix of drama and comedy  |  Appreciation for international cinema  ," I enjoy films that blend emotional depth with humor, as seen in titles like ""Wonder Boys"" and ""For Richer or Poorer.""|  I gravitate towards films from various cultures, such as ""Vagabond"" and ""Red Sorghum,"" which showcase unique storytelling styles."
 I enjoy heartfelt dramas with strong character development.  |  I appreciate films that blend music and storytelling.  ," Movies like ""Nashville"" often explore complex relationships and emotional journeys, which resonate with me.|  The musical elements in ""Nashville"" enhance the narrative, making me drawn to similar films that incorporate soundtracks as a vital part of their storytelling."
 Eclectic mix of drama and comedy  |  Appreciation for thought-provoking narratives  ," I enjoy a wide range of films that blend emotional depth with humor, evident in my ratings for titles like ""Adventures in Babysitting"" and ""Scent of a Woman.""|  I gravitate towards films that challenge conventional storytelling, as seen in my high ratings for ""Nineteen Eighty-Four"" and ""Trainspotting."""
 Eclectic mix of drama and art-house films  |  Appreciation for international cinema and animation  ," I enjoy films that explore deep emotional narratives and unique storytelling styles, as seen in titles like ""Stranger Than Paradise"" and ""Antonia's Line.""|  I am drawn to diverse cultural perspectives and innovative animation, evident in my high ratings for ""Ghost in the Shell"" and ""Seven Samurai."""
 I enjoy a blend of drama and romance.  |  I appreciate unique storytelling and artistic cinematography.  ," Many of the films I rated highly, such as ""Mildred Pierce"" and ""Grace of My Heart,"" showcase strong emotional narratives and character development.|  Movies like ""Chungking Express"" and ""Wings of Desire"" highlight innovative visual styles and unconventional narratives that resonate with me."
 Eclectic blend of drama and comedy  |  Appreciation for thought-provoking narratives  ," I enjoy films that balance emotional depth with humor, as seen in titles like ""Bringing Up Baby"" and ""Crimes and Misdemeanors.""|  I am drawn to movies that challenge conventional storytelling and provoke reflection, evident in my ratings for ""Citizen Kane"" and ""Gattaca."""
 Emotional and Thought-Provoking Dramas  |  Engaging Sci-Fi and Thrillers  ," I enjoy films that explore deep emotional themes and complex characters, as seen in titles like ""Braveheart"" and ""Sling Blade.""|  I am drawn to movies that combine imaginative storytelling with suspenseful elements, exemplified by ""E.T. the Extra-Terrestrial"" and ""Seven (Se7en)."""
 Romantic Comedies and Feel-Good Films  |  Classic Adventures and Family-Friendly Stories  ," I enjoy lighthearted stories that blend humor with romance, as seen in movies like ""You've Got Mail"" and ""Happy, Texas.""|  I appreciate films that offer a sense of adventure and nostalgia, such as ""Swiss Family Robinson"" and ""101 Dalmatians."""
 I enjoy quirky comedies with a unique sense of humor.  |  I appreciate action-packed sci-fi films with strong narratives.  ," Movies like ""Raising Arizona"" and ""Fletch Lives"" showcase offbeat characters and absurd situations that resonate with my comedic preferences.|  ""Aliens"" and ""Terminator 2: Judgment Day"" feature thrilling plots and intense action sequences that keep me engaged and entertained."
 I enjoy thought-provoking dramas and emotional narratives.  |  I appreciate imaginative and visually stunning films.  ," My ratings reflect a preference for films like ""Schindler's List,"" ""My Life as a Dog,"" and ""Leaving Las Vegas,"" which explore deep human experiences and complex characters.|  I have rated movies such as ""Fantasia,"" ""Jurassic Park,"" and ""Metropolis"" highly, indicating my enjoyment of creative storytelling and striking visuals in cinema."
 I enjoy a mix of drama and romance.  |  I appreciate films with a blend of suspense and dark humor.  ," Many of the movies I rated highly, like ""Titanic"" and ""Erin Brockovich,"" showcase strong emotional narratives and character development.|  My high ratings for movies like ""Rear Window"" and ""Sling Blade"" reflect my interest in stories that combine tension with clever, often ironic storytelling."
 I enjoy thought-provoking dramas and emotional narratives.  |  I appreciate classic and timeless storytelling.  ," Many of the films I rated highly, such as ""Dead Man Walking"" and ""Boys Don't Cry,"" focus on deep, complex themes and character-driven stories.|  My high ratings for films like ""Miracle on 34th Street"" and ""Arsenic and Old Lace"" reflect my enjoyment of well-crafted narratives that have stood the test of time."
 I enjoy a mix of comedy and drama.  |  I appreciate thought-provoking and unconventional storytelling.  ," My ratings reflect a strong appreciation for films that blend humor with deeper emotional narratives, as seen in titles like ""When Harry Met Sally..."" and ""Erin Brockovich.""|  I tend to favor films that challenge norms and provoke discussion, evident in my high ratings for ""Psycho,"" ""A Clockwork Orange,"" and ""Crimes and Misdemeanors."""
 I enjoy a mix of comedy and drama.  |  I am drawn to science fiction and fantasy.  ," My ratings reflect a strong appreciation for films that blend humor with emotional depth, such as ""My Cousin Vinny"" and ""Dead Poets Society.""|  I have rated several iconic sci-fi and fantasy films highly, including ""Star Trek: First Contact,"" ""Forbidden Planet,"" and ""Princess Mononoke."""
 Thought-provoking dramas and character-driven narratives  |  Engaging and unconventional storytelling  ," I enjoy films that explore complex themes and deep character development, as seen in titles like ""Pather Panchali"" and ""Rosetta.""|  I appreciate movies that offer unique perspectives and innovative plots, which is evident in my high ratings for ""Fantastic Planet, The"" and ""Felicia's Journey."""
 Emotional and Thought-Provoking Dramas  |  Classic and Timeless Stories  ," I enjoy films that explore deep emotional themes and complex characters, often reflecting on societal issues and personal struggles.|  I appreciate movies that tell enduring tales, often featuring strong narratives and memorable performances that resonate across generations."
 Thought-provoking dramas and character-driven narratives  |  Engaging and imaginative storytelling  ," I enjoy films that explore complex themes and deep character development, as seen in titles like ""Miller's Crossing"" and ""Heavenly Creatures.""|  I appreciate movies that offer unique and creative plots, such as ""Willy Wonka and the Chocolate Factory"" and ""2001: A Space Odyssey."""
 I enjoy a mix of comedy and satire.  |  I appreciate thought-provoking dramas and science fiction.  ," My ratings for films like ""Monty Python and the Holy Grail,"" ""Airplane!,"" and ""South Park: Bigger, Longer and Uncut"" show my appreciation for humor that often includes social commentary and absurdity.|  My high ratings for movies such as ""Blade Runner,"" ""American Beauty,"" and ""12 Angry Men"" indicate that I am drawn to narratives that explore complex themes and character development."
 Emotional and thought-provoking dramas  |  Engaging international cinema  ," I enjoy films that explore deep human experiences and complex relationships, as seen in titles like ""To Live"" and ""M. Butterfly.""|  I appreciate diverse storytelling and cultural perspectives, which is reflected in my ratings for movies like ""Wild Reeds"" and ""Midaq Alley."""
 Emotional and Thought-Provoking Dramas  |  Whimsical and Imaginative Adventures  ," I enjoy films that explore deep emotional themes and complex characters, as seen in titles like ""Shadowlands,"" ""All About My Mother,"" and ""Paths of Glory.""|  I appreciate movies that offer a sense of wonder and creativity, such as ""Labyrinth,"" ""Davy Crockett, King of the Wild Frontier,"" and ""Thomas and the Magic Railroad."""
 Emotional and Thought-Provoking Dramas  |  Artful and Visually Stunning Documentaries  ," I enjoy films that explore deep emotional themes and complex human relationships, often featuring character-driven narratives.|  I appreciate movies that offer unique perspectives on life and culture, often presented through striking visuals and compelling storytelling."
 I enjoy thought-provoking dramas and intense psychological thrillers.  |  I have a strong affinity for iconic and innovative cinema.  ," My ratings for films like ""Taxi Driver,"" ""Schindler's List,"" and ""Fatal Attraction"" reflect my appreciation for complex characters and deep emotional narratives.|  My high ratings for movies such as ""Full Metal Jacket,"" ""Braveheart,"" and ""One Flew Over the Cuckoo's Nest"" indicate my interest in films that have made a significant impact on the film industry and storytelling."
 I enjoy thought-provoking dramas and character-driven narratives.  |  I appreciate a mix of light-hearted comedies and adventurous tales.  ," Many of the films I rated highly, like ""Pather Panchali"" and ""Burnt By the Sun,"" focus on deep emotional themes and complex characters.|  My ratings for movies like ""Police Academy"" and ""Jumanji"" show that I enjoy humor and fun, while also enjoying action and adventure in films like ""Robin Hood: Prince of Thieves."""
 Emotional and Character-Driven Dramas  |  Unique and Thought-Provoking Narratives  ," I enjoy films that explore deep emotional themes and complex character relationships, as seen in titles like ""Enchanted April"" and ""Music of the Heart.""|  I appreciate movies that offer unconventional storytelling and provoke thought, which is evident in my ratings for films like ""JLG/JLG - autoportrait de décembre"" and ""Time of the Gypsies (Dom za vesanje)."""
 I enjoy thought-provoking dramas and character-driven narratives.  |  I appreciate films that blend humor with poignant storytelling.  ," Many of the films I rated highly, such as ""Breaking the Waves"" and ""Gentleman's Agreement,"" focus on deep emotional themes and complex characters.|  Movies like ""Sunshine"" and ""Everything You Always Wanted to Know About Sex"" showcase a mix of comedic elements and meaningful messages, reflecting my preference for layered storytelling."
 Emotional and thought-provoking dramas  |  Engaging and unconventional narratives  ," I enjoy films that explore deep human experiences and relationships, as seen in titles like ""Brief Encounter"" and ""Antonia's Line.""|  I appreciate movies that offer unique storytelling and perspectives, reflected in my ratings for ""The Tin Drum"" and ""Lovers on the Bridge."""
 I enjoy a mix of drama and comedy.  |  I appreciate thought-provoking narratives and character-driven stories.  ," My ratings reflect a strong appreciation for films that blend emotional depth with humor, as seen in titles like ""My Cousin Vinny"" and ""Driving Miss Daisy.""|  Many of my favorite films, such as ""Taxi Driver"" and ""To Kill a Mockingbird,"" showcase complex characters and compelling plots that challenge societal norms."
 Eclectic mix of comedy and drama  |  Appreciation for unique storytelling  ," I enjoy films that blend humor with deeper emotional narratives, as seen in titles like ""Wonder Boys"" and ""Much Ado About Nothing.""|  I am drawn to films with unconventional plots and distinctive styles, such as ""Dr. Strangelove"" and ""Black Cat, White Cat."""
 I enjoy a mix of drama and dark comedy.  |  I am drawn to thought-provoking and unconventional narratives.  ," My ratings reflect a strong appreciation for films that explore complex emotional themes, often with a touch of humor, as seen in titles like ""Hamlet,"" ""Wonder Boys,"" and ""This Is Spinal Tap.""|  I tend to favor films that challenge traditional storytelling, such as ""Children of Paradise,"" ""Seventh Seal,"" and ""Monty Python and the Holy Grail,"" showcasing my interest in unique perspectives and artistic expression."
 I enjoy thought-provoking dramas and literary adaptations.  |  I appreciate films that blend humor with poignant themes.  ," Many of my high-rated films, like ""Good Will Hunting,"" ""Hamlet,"" and ""Farewell My Concubine,"" focus on deep character development and complex narratives.|  Movies such as ""Annie Hall,"" ""Wayne's World,"" and ""Driving Miss Daisy"" showcase my preference for comedies that also explore meaningful life experiences."
 I enjoy thought-provoking dramas and character-driven narratives.  |  I appreciate dark comedies and unconventional storytelling.  ," Many of the films I rated highly, such as ""My Own Private Idaho"" and ""Seventh Seal,"" focus on deep emotional themes and complex characters.|  My ratings for movies like ""Henry Fool"" and ""Dumb & Dumber"" indicate that I enjoy humor that blends with unique and sometimes surreal narratives."
 Emotional and thought-provoking dramas  |  Engaging and unique storytelling  ," I enjoy films that explore deep human experiences and complex relationships, as seen in titles like ""Sophie's Choice,"" ""Harold and Maude,"" and ""Schindler's List.""|  I appreciate movies that offer distinctive narratives and creative plots, which is evident in my favorites like ""Gladiator,"" ""Return of Martin Guerre,"" and ""Three Colors: Red."""
 I enjoy heartwarming comedies with a touch of adventure.  |  I appreciate films that combine humor with poignant themes.  ," Movies like ""Mrs. Doubtfire"" and ""Around the World in 80 Days"" blend humor with uplifting stories, making me feel good while being entertained.|  ""Butch Cassidy and the Sundance Kid"" and ""Life Is Beautiful"" showcase how humor can coexist with deeper emotional narratives, resonating with my viewing preferences."
 Eclectic mix of drama and comedy  |  Appreciation for international and art-house cinema  ," I enjoy films that blend emotional depth with humor, as seen in titles like ""Do the Right Thing"" and ""Dirty Dancing.""|  I gravitate towards unique storytelling and visual artistry, reflected in my love for movies like ""The Double Life of Veronique"" and ""Wings of Desire."""
 Eclectic mix of drama and dark comedy  |  Appreciation for thought-provoking science fiction  ," I enjoy films that blend serious themes with humor, as seen in titles like ""Best in Show"" and ""Dancer in the Dark.""|  I am drawn to movies that explore complex ideas and futures, evident in my high ratings for ""Gattaca"" and ""Twelve Monkeys."""
